{
  "schema": "efh.excel-environments/v1",
  "function_id": "FUNC.AND",
  "surface_name": "AND",
  "status_plain": "Readings of AND with a recorded Excel build: 1,210 input(s) over 1 recorded environment(s), Excel 16.0 build(s) 20430, all on Windows; none of these captures records the CPU. No input has been read in two environments, so no difference is known and none is ruled out. No reading from a Mac, Excel for the web, 32-bit Excel or an Intel CPU is recorded.",
  "environments": [
    {
      "env_id": "win-x64-16.0.20430-nr",
      "excel_version": "16.0",
      "excel_build": "20430",
      "platform": "windows",
      "os": "Windows (64-bit) NT 10.00",
      "excel_bitness": "64-bit",
      "cpu": "not-recorded",
      "cpu_vendor": "not-recorded",
      "cpu_microarchitecture": "not-recorded",
      "workbook_compatibility": "2",
      "update_channel": "not-recorded",
      "basis": "Recorded by the capture or its run rollup: Excel version and build, bitness, OS. Not recorded: CPU. Workbook Compatibility Version 2 as recorded. Update channel never recorded."
    }
  ],
  "readings": [
    {
      "env_id": "win-x64-16.0.20430-nr",
      "inputs_read": 1210,
      "first_observed": "2026-09-29",
      "last_observed": "2026-09-29",
      "evidence": [
        {
          "repository": "OxFunc-Evidence",
          "commit": "1a47dfcec7db3cf8b8343da312af474cbd3ddcf1",
          "path": "cache/w111-broad-regenerated-20260929/",
          "locator": null,
          "sha256": null,
          "note": "1 file(s) in this folder hold readings of this function"
        },
        {
          "repository": "OxFunc-Evidence",
          "commit": "1a47dfcec7db3cf8b8343da312af474cbd3ddcf1",
          "path": "cache/w111-snapshot-1534/inputs/numeric/",
          "locator": null,
          "sha256": null,
          "note": "1 file(s) in this folder hold readings of this function"
        },
        {
          "repository": "OxFunc-Evidence",
          "commit": "1a47dfcec7db3cf8b8343da312af474cbd3ddcf1",
          "path": "cache/w111-snapshot-1735/inputs/numeric/",
          "locator": null,
          "sha256": null,
          "note": "1 file(s) in this folder hold readings of this function"
        },
        {
          "repository": "OxFunc-Evidence",
          "commit": "1a47dfcec7db3cf8b8343da312af474cbd3ddcf1",
          "path": "cache/w111-snapshot-wrap-1952/inputs/numeric/",
          "locator": null,
          "sha256": null,
          "note": "1 file(s) in this folder hold readings of this function"
        },
        {
          "repository": "OxFunc",
          "commit": "05196c394f5400eb329c79b01b4a8d2bac7c228b",
          "path": "docs/function-lane/evidence/w111-broad-20260929/snapshot-wrap-1952/inputs/numeric/",
          "locator": null,
          "sha256": null,
          "note": "1 file(s) in this folder hold readings of this function"
        },
        {
          "repository": "OxFunc-Evidence",
          "commit": "1a47dfcec7db3cf8b8343da312af474cbd3ddcf1",
          "path": "runs/w111-broad-20260929/answers/",
          "locator": null,
          "sha256": null,
          "note": "1 file(s) in this folder hold readings of this function"
        }
      ]
    }
  ],
  "comparisons": [],
  "differences": [],
  "sensitivities": []
}
