{
  "schema": "efh.excel-environments/v1",
  "function_id": "FUNC.PDURATION",
  "surface_name": "PDURATION",
  "status_plain": "Readings of PDURATION with a recorded Excel build: 1,205 input(s) over 1 recorded environment(s), Excel 16.0 build(s) 20430, all on Windows; none of these captures records the CPU. No input has been read in two environments, so no difference is known and none is ruled out. A CPU dependence is expected and untested (see below). No reading from a Mac, Excel for the web, 32-bit Excel or an Intel CPU is recorded.",
  "environments": [
    {
      "env_id": "win-x64-16.0.20430-nr",
      "excel_version": "16.0",
      "excel_build": "20430",
      "platform": "windows",
      "os": "Windows (64-bit) NT 10.00",
      "excel_bitness": "64-bit",
      "cpu": "not-recorded",
      "cpu_vendor": "not-recorded",
      "cpu_microarchitecture": "not-recorded",
      "workbook_compatibility": "2",
      "update_channel": "not-recorded",
      "basis": "Recorded by the capture or its run rollup: Excel version and build, bitness, OS. Not recorded: CPU. Workbook Compatibility Version 2 as recorded. Update channel never recorded."
    }
  ],
  "readings": [
    {
      "env_id": "win-x64-16.0.20430-nr",
      "inputs_read": 1205,
      "first_observed": "2026-09-29",
      "last_observed": "2026-09-29",
      "evidence": [
        {
          "repository": "OxFunc-Evidence",
          "commit": "1a47dfcec7db3cf8b8343da312af474cbd3ddcf1",
          "path": "cache/w111-extended-regenerated-20260929/",
          "locator": null,
          "sha256": null,
          "note": "1 file(s) in this folder hold readings of this function"
        },
        {
          "repository": "OxFunc-Evidence",
          "commit": "1a47dfcec7db3cf8b8343da312af474cbd3ddcf1",
          "path": "cache/w111-snapshot-1534/inputs/extended/",
          "locator": null,
          "sha256": null,
          "note": "1 file(s) in this folder hold readings of this function"
        },
        {
          "repository": "OxFunc-Evidence",
          "commit": "1a47dfcec7db3cf8b8343da312af474cbd3ddcf1",
          "path": "cache/w111-snapshot-1735/inputs/extended/",
          "locator": null,
          "sha256": null,
          "note": "1 file(s) in this folder hold readings of this function"
        },
        {
          "repository": "OxFunc-Evidence",
          "commit": "1a47dfcec7db3cf8b8343da312af474cbd3ddcf1",
          "path": "cache/w111-snapshot-wrap-1952/inputs/extended/",
          "locator": null,
          "sha256": null,
          "note": "1 file(s) in this folder hold readings of this function"
        },
        {
          "repository": "OxFunc",
          "commit": "05196c394f5400eb329c79b01b4a8d2bac7c228b",
          "path": "docs/function-lane/evidence/w111-broad-20260929/snapshot-wrap-1952/inputs/extended/",
          "locator": null,
          "sha256": null,
          "note": "1 file(s) in this folder hold readings of this function"
        },
        {
          "repository": "OxFunc-Evidence",
          "commit": "1a47dfcec7db3cf8b8343da312af474cbd3ddcf1",
          "path": "runs/w111-extended-numeric-20260929/answers/",
          "locator": null,
          "sha256": null,
          "note": "1 file(s) in this folder hold readings of this function"
        }
      ]
    }
  ],
  "comparisons": [],
  "differences": [],
  "sensitivities": [
    {
      "sensitivity_id": "XS-PDURATION-001",
      "axis": [
        "cpu"
      ],
      "status": "expected-untested",
      "statement": "Handbook evidence record EV-FIN-0005 marks 7 of its counts for this function as CPU-scoped: the counted result depends on how the host CPU executes x87 instructions. Every reading recorded here was taken on an AMD Zen 2 processor or on a host whose CPU was not recorded; no reading on an Intel CPU, a Mac or Excel for the web exists, so a CPU difference is neither observed nor ruled out.",
      "evidence": [
        {
          "repository": "ExcelFunctionsHandbook",
          "commit": "cb1b19da3597dac1a9fe925f9f2d53b971730f8b",
          "path": "content/evidence/records/EV-FIN-0005.json",
          "locator": "counts[].cpu_scoped",
          "sha256": "0ad5968955eee37fcb60c9a9aaf5511a51d8f2a360bd7711bac46746f880dcc3",
          "note": null
        }
      ]
    }
  ]
}
