{
  "schema": "efh.excel-environments/v1",
  "function_id": "FUNC.ISREF",
  "surface_name": "ISREF",
  "status_plain": "Readings of ISREF with a recorded Excel build: 1,227 input(s) over 1 recorded environment(s), Excel 16.0 build(s) 20430, all on Windows; none of these captures records the CPU. No input has been read in two environments, so no difference is known and none is ruled out. No reading from a Mac, Excel for the web, 32-bit Excel or an Intel CPU is recorded.",
  "environments": [
    {
      "env_id": "win-x64-16.0.20430-nr",
      "excel_version": "16.0",
      "excel_build": "20430",
      "platform": "windows",
      "os": "Windows (64-bit) NT 10.00",
      "excel_bitness": "64-bit",
      "cpu": "not-recorded",
      "cpu_vendor": "not-recorded",
      "cpu_microarchitecture": "not-recorded",
      "workbook_compatibility": "2",
      "update_channel": "not-recorded",
      "basis": "Recorded by the capture or its run rollup: Excel version and build, bitness, OS. Not recorded: CPU. Workbook Compatibility Version 2 as recorded. Update channel never recorded."
    }
  ],
  "readings": [
    {
      "env_id": "win-x64-16.0.20430-nr",
      "inputs_read": 1227,
      "first_observed": "2026-09-29",
      "last_observed": "2026-09-29",
      "evidence": [
        {
          "repository": "OxFunc-Evidence",
          "commit": "1a47dfcec7db3cf8b8343da312af474cbd3ddcf1",
          "path": "cache/w111-broad-regenerated-20260929/answers-isref.json",
          "locator": null,
          "sha256": "11a8f42edfbcaccdcbaa98a0451da6b201548cc93174a45f6a8097f0bd1bc291",
          "note": null
        },
        {
          "repository": "OxFunc-Evidence",
          "commit": "1a47dfcec7db3cf8b8343da312af474cbd3ddcf1",
          "path": "runs/w111-broad-20260929/answers/answers-isref.json",
          "locator": null,
          "sha256": "07466bd6fb4dcbea815ff70a8117efc3e4d145e8a4328e18f3d7375a8d61f1b9",
          "note": null
        }
      ]
    }
  ],
  "comparisons": [],
  "differences": [],
  "sensitivities": []
}
