{
  "schema": "efh.excel-environments/v1",
  "function_id": "FUNC.PRICEMAT",
  "surface_name": "PRICEMAT",
  "status_plain": "Readings of PRICEMAT with a recorded Excel build: 2,404 input(s) over 1 recorded environment(s), Excel 16.0 build(s) 20430, all on Windows; where a CPU is recorded it is an AMD Zen 2. No input has been read in two environments, so no difference is known and none is ruled out. No reading from a Mac, Excel for the web, 32-bit Excel or an Intel CPU is recorded.",
  "environments": [
    {
      "env_id": "win-x64-16.0.20430-amd-zen2",
      "excel_version": "16.0",
      "excel_build": "20430",
      "platform": "windows",
      "os": "Windows (64-bit) NT 10.00",
      "excel_bitness": "64-bit",
      "cpu": "AMD Ryzen 7 4800H with Radeon Graphics",
      "cpu_vendor": "AMD",
      "cpu_microarchitecture": "Zen 2",
      "workbook_compatibility": "2",
      "update_channel": "not-recorded",
      "basis": "Recorded by the capture or its run rollup: Excel version and build, bitness, OS, CPU. The processor name is that of an AMD Zen 2 part (Ryzen 7 4800H). Workbook Compatibility Version 2 as recorded. Update channel never recorded."
    }
  ],
  "readings": [
    {
      "env_id": "win-x64-16.0.20430-amd-zen2",
      "inputs_read": 2404,
      "first_observed": "2026-09-24",
      "last_observed": "2026-09-25",
      "evidence": [
        {
          "repository": "OxFunc-Evidence",
          "commit": "1a47dfcec7db3cf8b8343da312af474cbd3ddcf1",
          "path": "cache/oracle-20430/build-20430/PRICEMAT.jsonl",
          "locator": null,
          "sha256": "67d21f7a89f57da73dd62062e4857c6c84201710ecee34e6a7b111add11fc258",
          "note": null
        },
        {
          "repository": "OxFunc-Evidence",
          "commit": "1a47dfcec7db3cf8b8343da312af474cbd3ddcf1",
          "path": "runs/w111-5-20260924/answers/answers-w1115-pricemat.json",
          "locator": null,
          "sha256": "56382118e09c91f42c33ffa851533283b66c024a3ad8e8b276160aec424f44cf",
          "note": null
        }
      ]
    }
  ],
  "comparisons": [],
  "differences": [],
  "sensitivities": []
}
