{
  "schema": "efh.excel-environments/v1",
  "function_id": "FUNC.ACCRINTM",
  "surface_name": "ACCRINTM",
  "status_plain": "Readings of ACCRINTM with a recorded Excel build: 2,406 input(s) over 1 recorded environment(s), Excel 16.0 build(s) 20430, all on Windows; recorded CPUs: AMD Zen 2. No input has been read in two environments, so no difference is known and none is ruled out. No reading from a Mac, Excel for the web, 32-bit Excel or an Intel CPU is recorded.",
  "environments": [
    {
      "env_id": "win-x64-16.0.20430-amd-zen2",
      "excel_version": "16.0",
      "excel_build": "20430",
      "platform": "windows",
      "os": "Windows (64-bit) NT 10.00",
      "excel_bitness": "64-bit",
      "cpu": "AMD Ryzen 7 4800H with Radeon Graphics",
      "cpu_vendor": "AMD",
      "cpu_microarchitecture": "Zen 2",
      "workbook_compatibility": "2",
      "update_channel": "not-recorded",
      "basis": "Recorded by the capture or its run rollup: Excel version and build, bitness, OS, CPU. The processor name is that of an AMD Zen 2 part (Ryzen 7 4800H). Workbook Compatibility Version 2 as recorded. Update channel never recorded."
    }
  ],
  "readings": [
    {
      "env_id": "win-x64-16.0.20430-amd-zen2",
      "inputs_read": 2406,
      "first_observed": "2026-09-24",
      "last_observed": "2026-09-25",
      "evidence": [
        {
          "repository": "OxFunc-Evidence",
          "commit": "1a47dfcec7db3cf8b8343da312af474cbd3ddcf1",
          "path": "cache/oracle-20430/build-20430/ACCRINTM.jsonl",
          "locator": null,
          "sha256": "24a058ab08d974c166986e7ad8a4269af6cc9b8d0d470c3fd07ad194df0e94cf",
          "note": null
        },
        {
          "repository": "OxFunc-Evidence",
          "commit": "1a47dfcec7db3cf8b8343da312af474cbd3ddcf1",
          "path": "runs/w111-5-20260924/answers/answers-w1115-accrintm.json",
          "locator": null,
          "sha256": "51c2334b121d321d485ed1a09a25aa136a04bafd337114e0509952e9818c682a",
          "note": null
        }
      ]
    }
  ],
  "comparisons": [],
  "differences": [],
  "sensitivities": []
}
