{
  "schema": "efh.excel-environments/v1",
  "function_id": "FUNC.GAMMA.DIST",
  "surface_name": "GAMMA.DIST",
  "status_plain": "Readings of GAMMA.DIST with a recorded Excel build: 77,847 input(s) over 2 recorded environment(s), Excel 16.0 build(s) 20131, 20430, all on Windows; recorded CPUs: AMD Zen 2. 77,653 input(s) were also read in captures that record no build (some may repeat inputs counted above); they are not counted. No input has been read in two environments, so no difference is known and none is ruled out. No reading from a Mac, Excel for the web, 32-bit Excel or an Intel CPU is recorded.",
  "environments": [
    {
      "env_id": "win-nr-16.0.20131-amd-zen2",
      "excel_version": "16.0",
      "excel_build": "20131",
      "platform": "windows",
      "os": "not-recorded",
      "excel_bitness": "not-recorded",
      "cpu": "AMD Ryzen 7 4800H with Radeon Graphics",
      "cpu_vendor": "AMD",
      "cpu_microarchitecture": "Zen 2",
      "workbook_compatibility": "not-recorded",
      "update_channel": "not-recorded",
      "basis": "Recorded by the capture or its run rollup: Excel version and build, CPU. Not recorded: bitness, OS. Platform is Windows because every OxFunc capture drove Excel through COM automation from PowerShell on Windows; the capture does not state the OS. The processor name is that of an AMD Zen 2 part (Ryzen 7 4800H). Workbook Compatibility Version not recorded. Update channel never recorded."
    },
    {
      "env_id": "win-x64-16.0.20430-nr",
      "excel_version": "16.0",
      "excel_build": "20430",
      "platform": "windows",
      "os": "Windows (64-bit) NT 10.00",
      "excel_bitness": "64-bit",
      "cpu": "not-recorded",
      "cpu_vendor": "not-recorded",
      "cpu_microarchitecture": "not-recorded",
      "workbook_compatibility": "2",
      "update_channel": "not-recorded",
      "basis": "Recorded by the capture or its run rollup: Excel version and build, bitness, OS. Not recorded: CPU. Workbook Compatibility Version 2 as recorded. Update channel never recorded."
    }
  ],
  "readings": [
    {
      "env_id": "win-nr-16.0.20131-amd-zen2",
      "inputs_read": 77653,
      "first_observed": "2026-07-16",
      "last_observed": "2026-07-18",
      "evidence": [
        {
          "repository": "OxFunc-Evidence",
          "commit": "1a47dfcec7db3cf8b8343da312af474cbd3ddcf1",
          "path": "cache/oracle/build-20131/GAMMA.DIST.jsonl",
          "locator": null,
          "sha256": "7be4cf990ea86df35907ab3ddc5113af026b3e2f01d980d1094765563860170d",
          "note": null
        }
      ]
    },
    {
      "env_id": "win-x64-16.0.20430-nr",
      "inputs_read": 194,
      "first_observed": "2026-09-29",
      "last_observed": "2026-09-29",
      "evidence": [
        {
          "repository": "OxFunc",
          "commit": "05196c394f5400eb329c79b01b4a8d2bac7c228b",
          "path": "docs/function-lane/evidence/w111-broad-20260929/hyperbolic/rejected-research/public-dependencies/answers-gamma.dist.json",
          "locator": null,
          "sha256": "3ca5445496c297341d00161edd2f4b5919886feb297182b7bd04eecd8a36d761",
          "note": null
        },
        {
          "repository": "OxFunc-Evidence",
          "commit": "1a47dfcec7db3cf8b8343da312af474cbd3ddcf1",
          "path": "runs/w111-sinh-expm1-dependencies-20260929/answers-gamma.dist.json",
          "locator": null,
          "sha256": "3ca5445496c297341d00161edd2f4b5919886feb297182b7bd04eecd8a36d761",
          "note": null
        }
      ]
    }
  ],
  "comparisons": [],
  "differences": [],
  "sensitivities": []
}
