{
  "schema": "efh.excel-environments/v1",
  "function_id": "FUNC.RADIANS",
  "surface_name": "RADIANS",
  "status_plain": "Readings of RADIANS with a recorded Excel build: 32,966 input(s) over 2 recorded environment(s), Excel 16.0 build(s) 19929, 20430, all on Windows; none of these captures records the CPU. 1 same-input comparison(s) between builds over 2 input-pair(s): no result differs. No reading from a Mac, Excel for the web, 32-bit Excel or an Intel CPU is recorded.",
  "environments": [
    {
      "env_id": "win-nr-16.0.19929-nr",
      "excel_version": "16.0",
      "excel_build": "19929",
      "platform": "windows",
      "os": "not-recorded",
      "excel_bitness": "not-recorded",
      "cpu": "not-recorded",
      "cpu_vendor": "not-recorded",
      "cpu_microarchitecture": "not-recorded",
      "workbook_compatibility": "2",
      "update_channel": "not-recorded",
      "basis": "Recorded by the capture or its run rollup: Excel version and build. Not recorded: bitness, OS, CPU. Platform is Windows because every OxFunc capture drove Excel through COM automation from PowerShell on Windows; the capture does not state the OS. Workbook Compatibility Version 2 as recorded. Update channel never recorded."
    },
    {
      "env_id": "win-x64-16.0.20430-nr",
      "excel_version": "16.0",
      "excel_build": "20430",
      "platform": "windows",
      "os": "Windows (64-bit) NT 10.00",
      "excel_bitness": "64-bit",
      "cpu": "not-recorded",
      "cpu_vendor": "not-recorded",
      "cpu_microarchitecture": "not-recorded",
      "workbook_compatibility": "2",
      "update_channel": "not-recorded",
      "basis": "Recorded by the capture or its run rollup: Excel version and build, bitness, OS. Not recorded: CPU. Workbook Compatibility Version 2 as recorded. Update channel never recorded."
    }
  ],
  "readings": [
    {
      "env_id": "win-nr-16.0.19929-nr",
      "inputs_read": 41,
      "first_observed": null,
      "last_observed": null,
      "evidence": [
        {
          "repository": "OxFunc-Evidence",
          "commit": "1a47dfcec7db3cf8b8343da312af474cbd3ddcf1",
          "path": "runs/W097-R-B-validation-cellref-module/comparisons/",
          "locator": null,
          "sha256": null,
          "note": "1 file(s) in this folder hold readings of this function"
        },
        {
          "repository": "OxFunc-Evidence",
          "commit": "1a47dfcec7db3cf8b8343da312af474cbd3ddcf1",
          "path": "runs/broad-scalar-cycle-010-cellref/comparisons/",
          "locator": null,
          "sha256": null,
          "note": "1 file(s) in this folder hold readings of this function"
        },
        {
          "repository": "OxFunc-Evidence",
          "commit": "1a47dfcec7db3cf8b8343da312af474cbd3ddcf1",
          "path": "runs/broad-scalar-cycle-011-cellref/comparisons/",
          "locator": null,
          "sha256": null,
          "note": "1 file(s) in this folder hold readings of this function"
        },
        {
          "repository": "OxFunc-Evidence",
          "commit": "1a47dfcec7db3cf8b8343da312af474cbd3ddcf1",
          "path": "runs/broad-scalar-cycle-012-cellref/comparisons/",
          "locator": null,
          "sha256": null,
          "note": "1 file(s) in this folder hold readings of this function"
        },
        {
          "repository": "OxFunc-Evidence",
          "commit": "1a47dfcec7db3cf8b8343da312af474cbd3ddcf1",
          "path": "runs/broad-scalar-cycle-013-cellref/comparisons/",
          "locator": null,
          "sha256": null,
          "note": "1 file(s) in this folder hold readings of this function"
        },
        {
          "repository": "OxFunc-Evidence",
          "commit": "1a47dfcec7db3cf8b8343da312af474cbd3ddcf1",
          "path": "runs/broad-scalar-cycle-014-cellref/comparisons/",
          "locator": null,
          "sha256": null,
          "note": "1 file(s) in this folder hold readings of this function; 1 further folder(s) not listed"
        }
      ]
    },
    {
      "env_id": "win-x64-16.0.20430-nr",
      "inputs_read": 32925,
      "first_observed": "2026-09-29",
      "last_observed": "2026-09-29",
      "evidence": [
        {
          "repository": "OxFunc-Evidence",
          "commit": "1a47dfcec7db3cf8b8343da312af474cbd3ddcf1",
          "path": "cache/w111-broad-regenerated-20260929/",
          "locator": null,
          "sha256": null,
          "note": "1 file(s) in this folder hold readings of this function"
        },
        {
          "repository": "OxFunc-Evidence",
          "commit": "1a47dfcec7db3cf8b8343da312af474cbd3ddcf1",
          "path": "cache/w111-snapshot-1534/inputs/numeric/",
          "locator": null,
          "sha256": null,
          "note": "1 file(s) in this folder hold readings of this function"
        },
        {
          "repository": "OxFunc-Evidence",
          "commit": "1a47dfcec7db3cf8b8343da312af474cbd3ddcf1",
          "path": "cache/w111-snapshot-1735/inputs/numeric/",
          "locator": null,
          "sha256": null,
          "note": "1 file(s) in this folder hold readings of this function"
        },
        {
          "repository": "OxFunc-Evidence",
          "commit": "1a47dfcec7db3cf8b8343da312af474cbd3ddcf1",
          "path": "cache/w111-snapshot-wrap-1952/inputs/numeric/",
          "locator": null,
          "sha256": null,
          "note": "1 file(s) in this folder hold readings of this function"
        },
        {
          "repository": "OxFunc",
          "commit": "05196c394f5400eb329c79b01b4a8d2bac7c228b",
          "path": "docs/function-lane/evidence/w111-broad-20260929/integer-publication/discovery/answers/",
          "locator": null,
          "sha256": null,
          "note": "1 file(s) in this folder hold readings of this function"
        },
        {
          "repository": "OxFunc",
          "commit": "05196c394f5400eb329c79b01b4a8d2bac7c228b",
          "path": "docs/function-lane/evidence/w111-broad-20260929/integer-publication/heldout/answers/",
          "locator": null,
          "sha256": null,
          "note": "1 file(s) in this folder hold readings of this function; 6 further folder(s) not listed"
        }
      ]
    }
  ],
  "comparisons": [
    {
      "comparison_id": "XC-RADIANS-001",
      "axis": [
        "excel-build"
      ],
      "env_ids": [
        "win-nr-16.0.19929-nr",
        "win-x64-16.0.20430-nr"
      ],
      "inputs_compared": 2,
      "inputs_differing": 0,
      "method": "Harvest (tools/efh-environments/harvest.py): Excel answers keyed by function and exact argument bits; every input read in both environments, results compared as typed values (numbers by their binary64 bits). Formula-literal captures excluded.",
      "evidence": [
        {
          "repository": "OxFunc-Evidence",
          "commit": "1a47dfcec7db3cf8b8343da312af474cbd3ddcf1",
          "path": "runs/broad-scalar-cycle-010-cellref/comparisons/excel_sample_comparisons.jsonl",
          "locator": null,
          "sha256": "b7f060ba4bff562ee5e2ad695f43d9067938e006a86dfd2274dd57016f296a66",
          "note": null
        },
        {
          "repository": "OxFunc-Evidence",
          "commit": "1a47dfcec7db3cf8b8343da312af474cbd3ddcf1",
          "path": "runs/broad-scalar-cycle-012-cellref/comparisons/excel_sample_comparisons.jsonl",
          "locator": null,
          "sha256": "79234fbbdfcf44dbc6b13309385c920b6ab82c86bb1655e9b07ee3c7b9be0e78",
          "note": null
        },
        {
          "repository": "OxFunc-Evidence",
          "commit": "1a47dfcec7db3cf8b8343da312af474cbd3ddcf1",
          "path": "cache/w111-broad-regenerated-20260929/answers-radians.json",
          "locator": null,
          "sha256": "558d8c00c906be0c5122fe227fdde03c2d588561a45ab8e0db62e786aae9d72a",
          "note": null
        },
        {
          "repository": "OxFunc-Evidence",
          "commit": "1a47dfcec7db3cf8b8343da312af474cbd3ddcf1",
          "path": "cache/w111-snapshot-1534/inputs/numeric/answers-radians.json",
          "locator": null,
          "sha256": "25f3f90fa3428749b4f6346605a210d62f12854bc12e8d85cfa3eb4401d39037",
          "note": null
        }
      ]
    }
  ],
  "differences": [],
  "sensitivities": []
}
